{
  "schemaVersion": "1.0.0",
  "templateId": "fashion-atelier-v1",
  "templateVersion": "1.3.0",
  "brand": {
    "name": "Verde",
    "displayName": "VERDE",
    "tagline": "Prueba de paleta de marca (acento #BCD98D).",
    "locale": "es-ES",
    "currency": "EUR"
  },
  "theme": {
    "colors": {
      "primary": "#2A3A22",
      "secondary": "#4A5A40",
      "cta": "#BCD98D",
      "ctaHover": "#C2C480",
      "background": "#F7F8F3",
      "surface": "#EEF0E8",
      "text": "#141810",
      "muted": "#5A6354",
      "border": "#DDE0D4"
    }
  },
  "features": {
    "cart": true,
    "newsletter": true,
    "account": true,
    "accountBasePath": "/cuenta"
  },
  "navigation": {
    "primary": [
      { "type": "path", "label": "Tienda", "href": "/tienda" },
      { "type": "shopFilter", "label": "Mujer", "categorySlug": "mujer" },
      { "type": "shopFilter", "label": "Hombre", "categorySlug": "hombre" },
      { "type": "path", "label": "Nosotros", "href": "/nosotros" }
    ]
  },
  "seo": {
    "titleTemplate": "%s · Verde",
    "default": {
      "title": "Verde — Prueba de tema",
      "description": "Fixture de paleta: CTA #BCD98D, apoyo #C2C480, primary oscuro derivado.",
      "openGraph": {
        "title": "Atelier — Moda contemporánea",
        "description": "Siluetas esenciales para una temporada de intención. Explora mujer, hombre y accesorios."
      }
    },
    "pages": {
      "shop": {
        "title": "Tienda",
        "description": "Explora la colección completa Atelier: mujer, hombre y accesorios."
      },
      "about": {
        "title": "Nosotros",
        "description": "La historia de Atelier: moda contemporánea con materiales nobles y diseño atemporal."
      }
    }
  },
  "catalog": {
    "categories": [
      {
        "id": "cat_mujer",
        "slug": "mujer",
        "label": "Mujer"
      },
      {
        "id": "cat_hombre",
        "slug": "hombre",
        "label": "Hombre"
      },
      {
        "id": "cat_accesorios",
        "slug": "accesorios",
        "label": "Accesorios"
      }
    ],
    "collections": [
      {
        "id": "col_otono",
        "slug": "otoño-essentials",
        "name": "Otoño Essentials",
        "description": "Capas precisas en lana, algodón y seda.",
        "image": {
          "url": "https://images.unsplash.com/photo-1490481651871-ab68de25d43d?w=1600&q=80",
          "alt": "Colección Otoño Essentials"
        }
      },
      {
        "id": "col_linen",
        "slug": "linen-edit",
        "name": "Linen Edit",
        "description": "Texturas naturales para el día a día.",
        "image": {
          "url": "https://images.unsplash.com/photo-1558769132-cb1aea458c5e?w=1600&q=80",
          "alt": "Colección Linen Edit"
        }
      },
      {
        "id": "col_noir",
        "slug": "atelier-noir",
        "name": "Atelier Noir",
        "description": "Siluetas nocturnas en negro absoluto.",
        "image": {
          "url": "https://images.unsplash.com/photo-1515886657613-9f3515b0c78f?w=1600&q=80",
          "alt": "Colección Atelier Noir"
        }
      }
    ],
    "products": [
      {
        "id": "1",
        "slug": "abrigo-cashmere-stone",
        "name": "Abrigo Cashmere Stone",
        "description": "Abrigo de cashmere con caída estructurada, solapas anchas y cinturón integrado. Pensado para capas en climas templados.",
        "price": 420,
        "categoryId": "cat_mujer",
        "collectionId": "col_otono",
        "colors": [
          "Stone",
          "Negro"
        ],
        "sizes": [
          "XS",
          "S",
          "M",
          "L"
        ],
        "image": {
          "url": "https://images.unsplash.com/photo-1544022613-e87ca75a784a?w=1200&q=80",
          "alt": "Abrigo Cashmere Stone"
        },
        "hoverImage": {
          "url": "https://images.unsplash.com/photo-1591047139829-d91aecb6caea?w=1200&q=80",
          "alt": "Abrigo Cashmere Stone vista alternativa"
        },
        "badges": [
          "new",
          "featured"
        ]
      },
      {
        "id": "2",
        "slug": "blazer-lino-natural",
        "name": "Blazer Lino Natural",
        "description": "Blazer desestructurado en lino europeo. Hombreras suaves y forro de cupro para un uso diario elevado.",
        "price": 280,
        "categoryId": "cat_mujer",
        "collectionId": "col_linen",
        "colors": [
          "Natural",
          "Olive"
        ],
        "sizes": [
          "XS",
          "S",
          "M",
          "L",
          "XL"
        ],
        "image": {
          "url": "https://images.unsplash.com/photo-1591369822096-ffd140ec948f?w=1200&q=80",
          "alt": "Blazer Lino Natural"
        },
        "badges": [
          "featured"
        ]
      },
      {
        "id": "3",
        "slug": "pantalon-wide-leg-noir",
        "name": "Pantalón Wide-Leg Noir",
        "description": "Wide-leg de lana peinada con pinzas frontales y cintura alta. Una pieza esencial del guardarropa Atelier.",
        "price": 195,
        "categoryId": "cat_mujer",
        "collectionId": "col_noir",
        "colors": [
          "Negro"
        ],
        "sizes": [
          "34",
          "36",
          "38",
          "40",
          "42"
        ],
        "image": {
          "url": "https://images.unsplash.com/photo-1509631179647-0177331693ae?w=1200&q=80",
          "alt": "Pantalón Wide-Leg Noir"
        },
        "badges": [
          "featured"
        ]
      },
      {
        "id": "4",
        "slug": "camisa-oxford-marfil",
        "name": "Camisa Oxford Marfil",
        "description": "Oxford de algodón peinado con cuello button-down y corte relaxed. Ideal sola o bajo un blazer.",
        "price": 145,
        "categoryId": "cat_hombre",
        "collectionId": "col_linen",
        "colors": [
          "Marfil",
          "Sky"
        ],
        "sizes": [
          "S",
          "M",
          "L",
          "XL"
        ],
        "image": {
          "url": "https://images.unsplash.com/photo-1602810318383-e386cc2a3ccf?w=1200&q=80",
          "alt": "Camisa Oxford Marfil"
        },
        "badges": [
          "new"
        ]
      },
      {
        "id": "5",
        "slug": "trench-tecnico-arena",
        "name": "Trench Técnico Arena",
        "description": "Trench con acabado water-repellent, forro desmontable y detalles de metal mate. Ligero y preciso.",
        "price": 365,
        "categoryId": "cat_hombre",
        "collectionId": "col_otono",
        "colors": [
          "Arena",
          "Negro"
        ],
        "sizes": [
          "S",
          "M",
          "L",
          "XL"
        ],
        "image": {
          "url": "https://images.unsplash.com/photo-1552374196-1ab2a1c593e8?w=1200&q=80",
          "alt": "Trench Técnico Arena"
        },
        "badges": [
          "featured"
        ]
      },
      {
        "id": "6",
        "slug": "vestido-seda-noche",
        "name": "Vestido Seda Noche",
        "description": "Vestido midi en seda lavada con escote asimétrico y espalda abierta. Movimiento fluido, presencia silenciosa.",
        "price": 310,
        "categoryId": "cat_mujer",
        "collectionId": "col_noir",
        "colors": [
          "Negro",
          "Champagne"
        ],
        "sizes": [
          "XS",
          "S",
          "M",
          "L"
        ],
        "image": {
          "url": "https://images.unsplash.com/photo-1566174053879-31528523f8ae?w=1200&q=80",
          "alt": "Vestido Seda Noche"
        },
        "badges": [
          "new",
          "featured"
        ]
      },
      {
        "id": "7",
        "slug": "bolso-tote-cuero",
        "name": "Tote Cuero Vegetal",
        "description": "Tote de cuero vegetal curtido, forro de lona y herrajes en latón envejecido. Capacidad generosa, silueta limpia.",
        "price": 240,
        "categoryId": "cat_accesorios",
        "collectionId": "col_otono",
        "colors": [
          "Cognac",
          "Negro"
        ],
        "sizes": [
          "Único"
        ],
        "image": {
          "url": "https://images.unsplash.com/photo-1590874103328-eac38a67478e?w=1200&q=80",
          "alt": "Tote Cuero Vegetal"
        }
      },
      {
        "id": "8",
        "slug": "zapatos-derby-cafe",
        "name": "Derby Café",
        "description": "Derby en piel full-grain con suela de cuero y costura Goodyear. Hechos para acompañar el ritmo de la ciudad.",
        "price": 290,
        "categoryId": "cat_hombre",
        "collectionId": "col_noir",
        "colors": [
          "Café",
          "Negro"
        ],
        "sizes": [
          "40",
          "41",
          "42",
          "43",
          "44",
          "45"
        ],
        "image": {
          "url": "https://images.unsplash.com/photo-1614252237980-3f4c6c0c8c0a?w=1200&q=80",
          "alt": "Derby Café"
        }
      },
      {
        "id": "9",
        "slug": "bufanda-merino-heather",
        "name": "Bufanda Merino Heather",
        "description": "Bufanda oversize en merino peinado. Tejido abierto, peso ligero y caída editorial.",
        "price": 95,
        "categoryId": "cat_accesorios",
        "collectionId": "col_otono",
        "colors": [
          "Heather",
          "Charcoal"
        ],
        "sizes": [
          "Único"
        ],
        "image": {
          "url": "https://images.unsplash.com/photo-1520903920243-00d872a2d1c9?w=1200&q=80",
          "alt": "Bufanda Merino Heather"
        },
        "badges": [
          "new"
        ]
      },
      {
        "id": "10",
        "slug": "falda-midi-plisada",
        "name": "Falda Midi Plisada",
        "description": "Falda midi con plisado fino y cintura elástica cubierta. Movimiento constante sin ruido visual.",
        "price": 175,
        "categoryId": "cat_mujer",
        "collectionId": "col_linen",
        "colors": [
          "Ivory",
          "Negro"
        ],